{
  "analysis_generated_at": "2026-06-29T15:30:00+00:00",
  "asset": {
    "asset_type": "stock",
    "currency": "USD",
    "exchange": "DEMO",
    "isin": null,
    "name": "Demonstration Asset",
    "symbol": "DEMO"
  },
  "bundle_version": "1.0",
  "coverage": {
    "data_completeness_pct": 94.0,
    "missing_critical_fields": [],
    "missing_optional_fields": [],
    "status": "ready",
    "uncertainty_level": "low"
  },
  "evidence_refs": [
    {
      "as_of": "2026-06-28",
      "field_paths": [
        "evidence.events[0]"
      ],
      "id": "evidence-9f8ca1735e1a4d38",
      "source_type": "official_filing",
      "source_url": "https://example.invalid/filing",
      "title": "Quarterly filing"
    },
    {
      "as_of": null,
      "field_paths": [
        "grounded_data.portfolio"
      ],
      "id": "evidence-8f5fb54d0a9a0e6f",
      "source_type": "portfolio_state",
      "source_url": null,
      "title": "ThesisOS portfolio"
    },
    {
      "as_of": null,
      "field_paths": [
        "grounded_data.technical"
      ],
      "id": "evidence-b576ce73bbddf945",
      "source_type": "technical_data",
      "source_url": null,
      "title": "ThesisOS technical"
    },
    {
      "as_of": null,
      "field_paths": [
        "grounded_data.framework"
      ],
      "id": "evidence-1688e0c54ffe9804",
      "source_type": "thesisos_engine",
      "source_url": null,
      "title": "ThesisOS framework"
    },
    {
      "as_of": null,
      "field_paths": [
        "grounded_data.valuation"
      ],
      "id": "evidence-1a2dec1f4c3d6e67",
      "source_type": "thesisos_engine",
      "source_url": null,
      "title": "ThesisOS valuation"
    },
    {
      "as_of": null,
      "field_paths": [
        "grounded_data.fundamentals"
      ],
      "id": "evidence-5f1f01a3c2710774",
      "source_type": "thesisos_engine",
      "source_url": null,
      "title": "ThesisOS fundamentals"
    },
    {
      "as_of": null,
      "field_paths": [
        "grounded_data.evidence"
      ],
      "id": "evidence-63a1c0d5ff91f8a1",
      "source_type": "thesisos_engine",
      "source_url": null,
      "title": "ThesisOS evidence"
    },
    {
      "as_of": null,
      "field_paths": [
        "grounded_data.market_context"
      ],
      "id": "evidence-9adfcdf0d8621740",
      "source_type": "thesisos_engine",
      "source_url": null,
      "title": "ThesisOS market context"
    }
  ],
  "grounded_data": {
    "evidence": {
      "coverage_percentage": 100,
      "events": [
        {
          "document_url": "https://example.invalid/filing",
          "event_date": "2026-06-28",
          "form": "10-Q",
          "headline": "Quarterly filing",
          "materiality": "high",
          "source_kind": "official"
        }
      ],
      "status": "ok"
    },
    "framework": {
      "score": 78,
      "signals": [
        "positive cash conversion",
        "manageable leverage"
      ],
      "status": "ok"
    },
    "fundamentals": {
      "free_cash_flow": 17000000,
      "revenue": 125000000,
      "status": "ok"
    },
    "market_context": {
      "rates": "restrictive",
      "status": "ok"
    },
    "portfolio": {
      "concentration_after_purchase": 4.2,
      "decision": "watch",
      "status": "ok"
    },
    "technical": {
      "status": "ok",
      "trend": "positive"
    },
    "valuation": {
      "assessment": "Valuation requires disciplined entry.",
      "score": 62,
      "status": "partial"
    }
  },
  "source": "thesisos",
  "source_types": [
    "official_filing",
    "portfolio_state",
    "technical_data",
    "thesisos_engine"
  ],
  "payload_sha256": "85a6b768cc7785b71e9544a5c98a33afd0bec2d0655990eb0354966f3a955fcd"
}
